{
  "alignment_sha256": "1821ed20b9b2fc1e5057e8796cbc565f854486df648b0e8bb9fd7a3441ae401c",
  "documents": {
    "count": 1,
    "sha256": "e8b21ee169bc11405daa10a5801aea2be752e742916783837211479956aefcd8",
    "source_snapshot_sha256": "b15a115404d618eb800aa816b88b841f21f0ca382295eb404d623132fc4e0cd3"
  },
  "generator": "kgdistiller",
  "graph_artifacts": [
    {
      "bytes": 37,
      "path": "knowledge/graph/diagnostics.json",
      "sha256": "e0c2924b0cf38903b5cc04c6b7491eb4acbcdfb846f4563bd1fe20d4953aff75"
    },
    {
      "bytes": 177,
      "path": "knowledge/graph/edges.jsonl",
      "sha256": "48fbbaa5548ec59b1341352e584bf714f01c6b1e5a6758c82b4fcbdd14a5887f"
    },
    {
      "bytes": 121,
      "path": "knowledge/graph/entries/by-source/notes/sets.md.jsonl",
      "sha256": "cdd6ea462905661c0272eccbf3eaf5ff78641d8e339fa932b5492d498bb0cae9"
    },
    {
      "bytes": 90,
      "path": "knowledge/graph/entries/meta/global/unscoped.jsonl",
      "sha256": "f5a29d05c9e71f6cd483abeb5219be63739240a0fc3e03858ac18ebf9e05c0a9"
    },
    {
      "bytes": 1668,
      "path": "knowledge/graph/manifest.json",
      "sha256": "82257666e4a5130e751e80f2ee7a8580f4934209b2359d9360ba8ce5a58c6f10"
    },
    {
      "bytes": 1370,
      "path": "knowledge/graph/nodes.jsonl",
      "sha256": "d6e8ad6b431768ca2c1fbccb833277fc67f7632f2d1700ea462206015e7c4c97"
    },
    {
      "bytes": 0,
      "path": "knowledge/graph/references.jsonl",
      "sha256": "e3b0c44298fc1c149afbf4c8996fb92427ae41e4649b934ca495991b7852b855"
    }
  ],
  "graph_sha256": "7f7bfe8e5c5657f562020203a76978f0bc8c57de2c4f7ce3634f0fa66ed72261",
  "identity_sha256": null,
  "layout": "snapshot-copy",
  "managed_paths": [
    "knowledge/.gitignore",
    "knowledge/alignments.json",
    "knowledge/documents.jsonl",
    "knowledge/entries/finite-set.md",
    "knowledge/graph/diagnostics.json",
    "knowledge/graph/edges.jsonl",
    "knowledge/graph/entries/by-source/notes/sets.md.jsonl",
    "knowledge/graph/entries/meta/global/unscoped.jsonl",
    "knowledge/graph/manifest.json",
    "knowledge/graph/nodes.jsonl",
    "knowledge/graph/references.jsonl",
    "knowledge/sources.json",
    "knowledge/store.json",
    "knowledge/vault.json",
    "notes/sets.md"
  ],
  "paths": {
    "alignments": "knowledge/alignments.json",
    "documents": "knowledge/documents.jsonl",
    "graph": "knowledge/graph",
    "identities": null,
    "registry": "knowledge/sources.json",
    "vault": "knowledge/vault.json"
  },
  "registry_sha256": "cd074bc9394c2a16c7ddcd451a58ff013c4fb5a7ba8907cea96af017eb496aa7",
  "schema": "kgdistiller-store-v1",
  "store_generation_sha256": "47ee4a460bc3c23e7d21b4ae4a7b63a511d6e38591c736c306b34d6c22414be1",
  "store_sha256": "b1ae308544440bf16741e370a604f0071f3a057fb3609d2bc0e0b1da7c6513e2",
  "vault_id": "3fc9090b-53c4-45b0-83f4-53370bc34f20",
  "vault_sha256": "08b851c39acc265eb853b2b9e5ca00b7b62f8a728192434531ad499ac96812ef"
}
